comment,label,label_id
بسیار عالییییی، قیمت مناسب، گرم به دستم رسید، رفتار پیک بسیار محترمانه، نوشابه زیرو خواستم و نان سنگک، که کوکا فرستادین و لواش که شاید حتما نداشتیدو جایگزین کردید. موفق باشید,HAPPY,0.0
غذا خیلى خوب بود امیدوارم کیفیت خراب نشه، ولى سرد به دستم رسید,HAPPY,0.0
غذا بسیار بد بود. قارچ بوی خیلی بدی میداد. لطفا به اطلاع رستوران برسانید,SAD,1.0
به معنای واقعی عالی. چقدر تمیز و لایه لایه چیده شده بود. لذت بردیم. در ضمن قشنگ برای ۳ نفر کافی بود. خیلی خیلی ممنون.,HAPPY,0.0
با سلام غذا خوب و خوش طمع بود اما روی سیخ جوجه حدود ۱۰ تا فلفل کبابی بزرگ و خیلی تند گذاشته‌ بودند که باعث تعجب من شد ولی در کل خیلی خوب بود,HAPPY,0.0
کباب کاردیش خوب بود. ولی جوجه زیاد خوب نبود,HAPPY,0.0
پیک به شدت طلب کار بود و بد برخورد کرد واقعا در خور اسنپ-ن-ست به کار گیری همچین آدمایی,SAD,1.0
بر خلاف اینکه غذاهای هایدا خوبه پیتزاش خیلی بد بود، وسطش خام و روش سوخته بود و واقعا مواد اولیش کیفیتش پایین بود.,SAD,1.0
زمان رسیدن سفارش نسبتا زیاد بود,HAPPY,0.0
با اینکه فاصله انچنانی ندارن با ادرس من چهار تا کوچه بیشتر از یک ساعت طول کشی بیاد وقتی هم که زسید اصلا کیفیت مطلوبی نداشت,SAD,1.0
پیتزا کاملا له شده به دستم رسید,SAD,1.0
دورچین ماهی فقط خیارشور بود. در صورتی که تو توضیحات خوراک ماهی چیزای دیگه‌ای هم داشت. نان هم خیلی کم بود واسه ۴ نفر. خوراک سفارش داده بودیم,SAD,1.0
مزه غذا افتضاح بود. چیزبرگر هم بدون پنیر بود و مزه روغن شدیدی میداد.,SAD,1.0
غذا از داخل ظرف یکبار مصرف داخل پلاستیک ریخته شده بود,HAPPY,0.0
پیتزای خوبی بود با قیمت مناسب و طعم خوشایند خیلی ممنون.,HAPPY,0.0
همبرگر کاملا سوخته بود. پنیر به قدری کم بود که فکر کردم پنیر نداره,SAD,1.0
من رب طبیعت سفارش دادم، پولش رو پرداخت کردم ولی متاسفانه نداشتید. کاش در اپلیکیشن موجودی محصولات رو بلافاصله آپدیت کنید.,HAPPY,0.0
اصلا خوب نبود در ضمن هزینه بسته بندی خیلی زیادی میگیره,SAD,1.0
کیفیت غذا خیلی بد بود نسبت ب قیمت,SAD,1.0
پیتزا کویین بیشتر مزه کله پاچه میداد، سیب زمینی با پنیر هم خمیر شده بود,HAPPY,0.0
من دو تا سیخ جدا سفارش دادم برای بچه هم بود بعد برداشتن دوتا سیخو گذاشتن توی یه ظرف یعنی به جای دوتا تیکه ته چین و دو سری سیب زمینی فقط یه سری بود,SAD,1.0
واقعا از باگت انتظار نداشتم که اینقدر کیفیت رو پایین بیاره داخل مرغ بوی زهم میداد و روی مرغ خمیر شده بود کاهو‌های برگر پلاسیده شده بود خیلی کیفیت ایندفعه پایین بود به علاوه خیلی هم تاخیر داشت من خواااهش میکنم مشتری هارو بی اعتماد نکنید,SAD,1.0
کیفیت ماسک فوق العاده بد و غیر قابل استفاده,SAD,1.0
خیلی سریع به دستمون رسید تشکر از برخورد خوب پیک,HAPPY,0.0
بالاخره یک صبحانه و املت همه چی تموم با بسته بندی و ارسال بموقع و بدون کم و کاست توی اسنپ فود پیدا کردم قطعا بازم سفارش خواهم داد فقط برای من اگر بجای نان بربری نان سنگک بود بنظرم سالم‌تر و بهتر بود و پیشنهادم قرار دادن سنگک بجای بربری هست موفق باشید,HAPPY,0.0
نسبت به قیمت خوبه,HAPPY,0.0
همیشه غذای سالم داره پلاک و علت انتخاب منه,HAPPY,0.0
قبلا مشتری ثابت بودم امشب پیتزا سیر استیک‌گرفتم واقعا بد بود الان حالت تهوع دارم,SAD,1.0
مثل همیشه عالی …طعم فوق العاده و لذیذ ممنونم,HAPPY,0.0
عالی غذا مثل همیشه عالی,HAPPY,0.0
من ماست سنتی سفارش دادم ولی شما ماست موسیر فرستادید و من واقعا دوست ندارم، کباب‌ها همیشه خوشمزه است ولی برنج نه، در ضمن ترشی کلم خیلی بد شده نسبت ب اوایل,HAPPY,0.0
اصلا برگرتون خوب نبود. یکیش ک کلا سرد بود. دوست نداشتم بسته بندی هم کاملا ضعیف. کاغذی ک دوره برگر میپیچید رنگش درمیاد ب ب نون و محتویات ساندیچ این باره چندمه ک این کاغذ دوره ساندویچم بوده. از بلوط بعید بود,SAD,1.0
پنیر روزانه حساب شده اما داخل بسته ارسالی نبود,SAD,1.0
اشتباه آوردن سفارش منو,SAD,1.0
خوشمزه و گرم، ارسال به موقع ممنون از اسنپ فود,HAPPY,0.0
همه چیز عالی بسته بندی و کیفیت میوه‌ها واقعن خوب بود فقط زمان ارسال بسیار طولانی بود بسته بندی رو دوست داشتم کاش ارسال هزینه اون هم ۱۰ هزار تومن نداشته باشه و دیگه اینکه سیب رمینی‌ها تمیز‌تر باشه نه با گل بقیه‌ی موارد ارسالی خیلی خوب بودند,HAPPY,0.0
مثل همیشه عالی فقط متاسفانه در بسته بندی زباله زیادی تولید میشه، ای کاش فکری بحالش میشد که انقدر پلاستیک و کارتن مصرف نشه,HAPPY,0.0
کیفیت خوب حجم بیشتر باشه بهتره,HAPPY,0.0
طبق معمول خوشمره ممنون از رستوران پسر خوب و پیک اسنپ,HAPPY,0.0
پاستااز همه نظر افتضاح بود,SAD,1.0
سس تخصصی سالاد سزار باید سیر بیشتری داشته باشد. پودر پنیر پارمزان هم حتما باید داشته باشد.,HAPPY,0.0
هم سری رسید هم گرم بود هم کیفیتش خوب بود,HAPPY,0.0
بسیار بی مزه بود و فقط با قارچ و پنیر پر شده بود,SAD,1.0
خیلی پیتزا ی خوشمزه‌ای بود ولی قیمت یکم زیاده,HAPPY,0.0
من از طریق دوستم با این رستوران اشنا شدم و الان خودم شدم مشتری ثابت. چندین بار غذاهای مختلف رو تست کردم و همیشه هم راضی بودم. به چند نفر از اشنایان هم معرفی کردم اینجا رو که پیش اونها هم روسفید بودم تاحالا. امیدوارم همیشه همین کیفیت رو حفظ کنن. با تشکر.,HAPPY,0.0
نان قندی همه جای دنیا به یک شکله واسم نون خشک شیرین فرستادین یک کیلو نون تستم بیات و مونده بود و سفت واقعا متاسفم بار اول و اخرم بود,SAD,1.0
کیفیت مرغ پایین بود خلیییی چرب بود و اینکه سفارشم رو بعد از کلی تاخیر ناقص فرستادن از باگت انتظار نمیرفت,SAD,1.0
کیفیت غذا خوب نبود,SAD,1.0
نان به تلخی می‌زد,HAPPY,0.0
چانو عالی بود. مارگاریتا واقعا سوخته بود و با یک پیتزا ایتالیایی مارگاریتا ک توش پر از گوجه و ریحون هست بسیارررررررر تفاورت داشت و بد بود. سبزیجات بدک نبود ولی مشکل کلی سفارش تاخیر در ارسال و سردیییییی زیاد بود از سیب بعیدع!!!,SAD,1.0
این پای آلبالو واقعا وقتی ندارید نفرستین چرا یه چیز دیگه میفرستین,SAD,1.0
افتضاح افتضاح افتضاح. سنگک میفرستادین با ماست میخوردیم بهتر بود. اینم شد پیتزا؟ بابت انتخابم متاسفم همین,SAD,1.0
همه چی عالی فقط ظرف سالاد شیرازی و بورانی اصلا مناسب نبود و ریخته بود. مثل ظرفای سبزی کوکو پملپ باید باشه بنظرم.,HAPPY,0.0
زیاد طول میکشه تا برسه چون سالاد اماده هست نمیدونم چرا دیر میرسه,HAPPY,0.0
باتشکر …طعم غذا عالی بود.,HAPPY,0.0
تحویل سفارش نزدیک به دو ساعت طول کشید و اسنپ هم جواب درست نمیداد. خیلی بد,SAD,1.0
مثل همیشه عالی و خوشمزهههههه مرسی باگت عزیز,HAPPY,0.0
آبمیوه سن ایچ آناناس سفارش دادم نکتار انبه تکدانه ارسال شد,SAD,1.0
کیفیت معمولی بود و تازه هم نبود یک روز قبلتر سفارش چیز دیگر داده بودم لحظه آخر گفتند نداریم ….. مجبورا عوض کردم,HAPPY,0.0
مقدار فیله توی ساندویچ خیلی کم بود واینکه پوره سیب زمینی کلا نیومد,SAD,1.0
عالییییییییی بود سالم و رژیمی خوشمزه,HAPPY,0.0
زرشک پلو به شدت شور بود. یعنی شور بودا …. فک کنم یه ملاقه نمک خورده باشم همراه غذا. ضمن اینکه مرغ هم درست تمیز نشده بود.,SAD,1.0
از ۲۰ نمره ۱۵ میشید,HAPPY,0.0
با تاخیر خیلی خیلی زیاد رسید ولی خب ولی کیفیت بارن همیشه خوبه,HAPPY,0.0
عالی با کیفیت داغ سریع و زیاد,HAPPY,0.0
افتضاح بود غذا سرد همه برنج‌ها ریخته بود خیلی افتضاح بود,SAD,1.0
شیرینی‌ها تازه نبودن و به جز جعبه‌ی شیرینی قاعدتا باید ساک و کیسه‌ای که بشه حملش کرد تو دست هم میدادین,SAD,1.0
کیفیت پایین انگار مونده بود,SAD,1.0
تیرامیسو بد اصلا خوب نبود دسر نوتلا هم خیلی بد بود خواهش میکنم رسیدگی کنید دفعه آخری بود که سفارش میدم,SAD,1.0
"واقعا متاسفم واسه این سفارشم برنج خارجی با کیفیت پایین خشک و بی مزه نصف غذارو دور ریختم , کیفیت جوجه هم واقعا تو ذوق میزد اصلا واسه کیفیت این غذا هیچ وقتی گذاشته نشده بود دیگه عمرا سفارش بدم",SAD,1.0
بسیار گوشت خورشتی تمیز و پاکیزه عالی بود,HAPPY,0.0
غذا کاملا سرد شده بود. یک عدد گوجه فرنگی ناقص و لهیده نیز قابل مصرف نبود.,SAD,1.0
پیتزا سرد و بدمزه بود و نوشابه‌ها گرم,SAD,1.0
خیلی خوش طعم بود و حجم زیاد داشت دور چینش خیلی خوب بود خیلی زود و گرم هم به دستم رسید از اسنپ فود و فیلیپر ممنونم,HAPPY,0.0
تمام شیرینی بهم ریخته بود قابل استفاده نبود,SAD,1.0
واقعا کیفیت قبل رو نداره. مدتیه نداره سوخاری خمیر که روغن زیادی بهش ماسیده بود,SAD,1.0
بی نظیر، خوشمزه و منظم,HAPPY,0.0
کاش خوراک هم توی منو بود - غذای باکیفیت و خوشمزه‌ای بود - امیدوارم کیفیت حفظ بشه,HAPPY,0.0
کمی استیک بوقلمون شور بود,HAPPY,0.0
کیفیت اومده پایین و حجم غذا کم شده با توجه به اینکه قیمت افزایش هم داشته، علاوه بر این سیب زمینی با سس قارچ هم داشتم توی سفارشم که خیلی سرد رسید سس قارچ بسیار بی کیفیت بود، بیشتر سوپ رقیق قارچ بود (آب زیپو). از باروژ بعید بود، شایدم فقط شعبه کوروش اینجوری بی کیفت هست.,SAD,1.0
ماشروم برگر به شدت بوی چربی و دنبه می‌داد. و با بوی بد کاغذ بسته بندی مخلوط شده بود. غذا تقریبا سرد دریافت شد.,SAD,1.0
سالاد سزار: ظرفی پر از کاهو با چند تکه مرغ گریل شده. بدون حتی یک تکه گوجه گیلاسی و زیتون,SAD,1.0
شیرینی تازه نبود و کمی تیره و سوخته بود,HAPPY,0.0
خیلی عالی بود. مثل همیشه. کم شربت بود و نامبروان.,HAPPY,0.0
خیلی برنج افتضاح بود، در هر سه غذا، ضمنا کیفیت خورشت‌ها و جوجه نیز واقعا غم انگیز بود,SAD,1.0
کیفیت غذا خوب بود بسته بندی هم خوب بود فقط غذا دیر رسید و همراه غذا سرویس نبود نه نون بود نه پیاز نه لیمو,HAPPY,0.0
این دفه سوسیسی که در پیتزا به کار رفته بود خیلی تند بود ولی دفه‌های قبل سوسیس به کار رفته دردیتزا اینقد تند نبود این دفه خیلی خیلی تند بود سوسیس به کار رفته در پیتزا لطفا مدیریت رستوران رسیدگی کند بعدشم پیشنهاد می‌دم برا پیتزا مخصوصتون از سوسیس معمولی لطفا استفاده بفرمایید لطفا این مورد مثل مورد قبل مدیریت رستوران رسیدگی کند ممنون می‌شم,SAD,1.0
عالی بود عالی بالای پنج یا شیش بار نون خامه‌ای خورشید رو سفارش دادم مزش و تازگیش بی نظیره بی نظیر,HAPPY,0.0
واقعا ضعیف‌ترین ویتامینه و گلاسه ایی بود که تو کل زندگیم خوردم، اصلا توصیه نمیکنم.,SAD,1.0
افتضاح بود نابود شده بود,SAD,1.0
کیفیت غذا خوب بود و زمان ارسال هم کمتر از ۳۰ دقیقه شد. عالی بود همه چیز,HAPPY,0.0
اصلا به توضیحات توجه نمیکنن و نان تستی که فرستاده بودن هم تازه نبود,SAD,1.0
تو‌سفارش من ماست بود ولی متاسفانه نفرستادید.,HAPPY,0.0
یه نان سنگک سیاه دانه و یه نان سنگک ساده سفارش دادم ولی متاسفانه دوتا نان کنجدی معمولی آمد,HAPPY,0.0
میکس ترش معرکه بود. مثل همیشه عالی,HAPPY,0.0
باقاوا جوری تو جعبه چیده شده بود که انگار ازش برداشته شده میتونستن از یا جعبه‌ی کوچیکتد استفاده کنن خدا روسکر که ار روی کنجکاوی که بببنم ار کدوما گذاشتن در جعبه رو باز کردم و دیدم وگرنه آبروم پیش میزبان میرفت,HAPPY,0.0
در کل بد نبود، ولی خامه داخل نون خامه‌ای و رولت خیلی زیاد بود، من خودم عاشق خامه هستم، ولی مال این خیلی زیاد بود، بطوریکه نصف خامه شو جدا کردم. ممنون,HAPPY,0.0
بهتره پرشن قابل خرید از شیرینی‌ها رو به نیم کیلو تقلیل بدین که مثلا بشه نیم کیلو از یک نوع و نیم کیلو از نوع دیگر خرید کرد یک کیلو از یه نوع زیاده,HAPPY,0.0
مصل همیشه عالییییی نیازی ب توضیح نیست,HAPPY,0.0
یکی از بسته‌ها کمتر از مقدار نیم کیلو سفارش داده شده بود. هیچ رسیدی هم از طرف سولدوش نداده بودند. و مقدار وزنی مشخص نبود. بعد از توزین فقط یکی درست بود.,SAD,1.0
قرمه سبزی مونده بود و بدمزه,SAD,1.0
با سلام و خسته نباشید بسیار عالی بود. داغ و تازه همه چیز عالی. برخورد پیک محترم هم کاملا محترمانه از اسنپ فود هم بابت پیامک تخفیف سپاس گذارم,HAPPY,0.0
مواد غذایی مصرفی کهنه بود … بخصوص گوشت استیک و بوقلمون,SAD,1.0
کباب اصلا خوب نبود مزه بدی داشت، برنج خوب بود سوپ خوب بود که گذاشته بودن جوجه نه بد بود نه عالی بود غذا زود رسید و گرم بود در کل نسبت به حجم غذا و قیمت خوب بود,SAD,1.0
حجم سیب زمینی کم بود قبلا داخل ظرف جدا بود,SAD,1.0
مثل همیشه خوش طعم، فقط پنیر روی پیتزا کمی بیشتر از حد معمول برشته شده بود,HAPPY,0.0
من واقعا نمیدونم سنگ محک اسنپ برای امتیاز دادن چیست؟؟؟؟؟؟!!! ایا واقعا امتیازاتیس که مردم به رستورانها میدهند و یا به خاطر برند بودنشون انها در صدر هستند، غذا به شدت معمولی بود اما قیمت نسبت به کیفیت غذا بالا بود ماستی که به عنوان گیفت گذاشته بودن هیچ طعم خاصی نداشت، جوجه کباب با اسمهای جذاب اصلا خوشمزه نبودن … …,SAD,1.0
کروسان شکلاتی امیدوارم همینجور بمونه,HAPPY,0.0
واقعا ارسال افتضاح بود، ارسالی که ۳۵ دقیقه زمان خورده بود، یک ساعت و ۲۲ دقیقه طول کشید!!! سیب زمینی خمیر! پیتزا و قارچ سرد! ما به پشتوانه اسنپ بود سفارش می‌دهیم و از از اسنپ فوت پشتیبانی خیلی بهتری می‌خواهیم.,SAD,1.0
عالی بود مخصوصا پیتزا آلفردو,SAD,1.0
در کل ترشی ۵ عدد زیتون بود و بقیه فلفل بود در صورتی که اسم محصول ترشی زیتون هالیپ-ن- بود. کاملا از پرداخت این پول برای مقداری فلفل ناراضی ام,SAD,1.0
واقعا راضی بودم ممنون,HAPPY,0.0
پیتزای خوب و خوش مزه‌ای بود. ممنونم. فقط نمیدونم چرا برای ۲ عدد پیتزا باید مبلغ ۹ هزار تومان مالیات از مشتری دریافت بشه؟,HAPPY,0.0
به شدت شور بود.,SAD,1.0
بد نبود. سرد بود,HAPPY,0.0
سلام خسته نباشید مثل همیشه عالی بود ممنمون,HAPPY,0.0
Thank you so much,HAPPY,0.0
بنظرم کلمه مرغ رو ازش حذف کنید!! فقط به اندازه دو تا قوطی کبریت مرغ گذاشته بودن. نون و ماست و پیازچه خوردم. واقعا براتون متاسفم!,SAD,1.0
کباب لقمه خیلی خیلی سفت بود و نصف بیشترش موند و بوی تخم مرغ ته چین بیشتر از هر چیزی آزار دهنده بود,SAD,1.0
چیدمانش خیلی بد بود مزش هم خوب نبود,SAD,1.0
خیلی معمولی و بیمزه,SAD,1.0
مث پرپروک قدیم نیست,SAD,1.0
پیتزا سیب یکی از بهترینای تهرانه به خصوص پپرونی هاش فقط دوتا نکته درباره سفارش امشبم وجود داشت، پنیر سیب زمینی به جعبه چسبیده بود و فقط این دفعه هم نبود دفعات قبل هم همینجور بود، از نظر من بهتره که واسه وقتی ارسال میشه غذا پنیر وسط سیب زمینی هم قرار داده بشه پیتزا هم زیادی تو فر مونده بود و سوخته بود یکم پنیر ولی مثل همیشه مزش عالی بود با تشکر,HAPPY,0.0
رستوران شیلا که مثل همیشه عالی و بی نظیر می‌باشد. انتقاد فقط بروی هزینه زیاد ارسال سفارش (اسنپ اکسپرس) می‌باشد که با توجه به فاصله‌ای که با رستوران داریم، هزینه ۶۰۰۰ تومان اصلا منطقی به نظر نمی‌آید.,HAPPY,0.0
کیفیت و حجم غذا خیلی خوب بود، غذا هم خیلی زود به دستمون رسید و تقریبا داغ بود، ممنون از مدیریت فست فود گاراژ، امیدوارم کیفیت غذاهاتون همیشه همینطور بمونه,HAPPY,0.0
سرد بود و خواسته بودیم از وسط نصف بشه که اصلن مناسب نصف نشده بود,HAPPY,0.0
نان خامه‌ای خوب تخمه خیلی تازه نبود,HAPPY,0.0
تنوع اجناس بسیار خوب، سرعت تحویل بالا، کمتر پیس میاد خطایی انجام بدن,HAPPY,0.0
نان تست بیات که در تستر هم گذاشته نشده بود خلاصه کلی خمیر خوردم,SAD,1.0
ممنونم خوشمزه بود اما هیچ اهمیتی ندادین نسبت به تغییر نوع زیتون به کار رفته در پیتزا تورینو,HAPPY,0.0
هم خشک بود هم کوچیک و به جای جعبه مربع، داخل مستطیل گذاشته شده بود و بیشترش برگشته بود، واقعا آبرو مارو جلو مهمون بردید دفعه اول و آخرمون بود خرید کردم موفق باشید,SAD,1.0
از تاریخ مصرف سس یک ماه فقط مونده بود!,HAPPY,0.0
بسیار عالی وخوشمزه. سپاس,HAPPY,0.0
خوب و خوشمزه بود مرسب,HAPPY,0.0
خیلی خوشمزه بود. باز هم سفارش خواهم داد,HAPPY,0.0
همه محصولات بسیار عالی تازه و تمیز ممنون,HAPPY,0.0
بد‌ترین پیتزایی بود که تا حالا خورده بودم خدا به دادم برسه زنده برسم خونه امروز,SAD,1.0
خامه زیادی چرب بود و در دهن میماسید. در کل خوب بود. ممنون اسنپ، سریع و کاملا سالم رسوند,HAPPY,0.0
بهترین سوپرمارکت هرچی نداشته باشند رو باهات چک می‌کنند و سر حوصله جایگزین می‌کنند خیلی راضیم ازشون مرسی,HAPPY,0.0
خیلی معمولی بود. و کالباس پیتزا رنده شده بود که شکل جذابی بهش نمیدهد.,HAPPY,0.0
غذا بسیار خوب بود فقط فکر می‌کنم هزینه بسته بندی کمی گران است,HAPPY,0.0
غذا خیلی عالی بود مثل همیشه من خونمون نزدیکه انقلابه ولی همیشه از شعبه ستارخان میگیرم چون غذاش خیلی عالیه ولی پیک منو تا دمه در کشوند که پام پلاتین داره و نمیتونم را بیام، نمیدونم این پیکا جدیدا چرا همه پاهاشون پلاتین داره,SAD,1.0
غذا عالی ودمتون گرم خدا برکت بده به کسب کارتون,HAPPY,0.0
ترد و خوشمزه بود,HAPPY,0.0
بسیااار عالی بود. کلا تو منطقه ۵ آلپارو جزء بهترینهاست. غذا کاملا داغ و با کیفیت. واقعا کمی صبر کردیم تا خنک شد. زودتر از زمان اعلام شده هم رسید,HAPPY,0.0
خوب بود ولی اون مدلی که روی عکس تبلیغش بود رو نفرستادی بودین اما در کل مثل همیشه خوشمزه بود,HAPPY,0.0
کیفیتش بد نبود ولی همونجور که اکثرا نوشته بودن با تاخیر اومد,HAPPY,0.0
خیلی بد بود … تیکه‌های مرغ سوخاری خیلی بزرگ بود و غیر قابل خوردن … حجم زیادی از سیب زمینی رو داخل جعبه کوچیک ریخته بودند که همش له شده بودن … واقعا بد بود …دیگه از این مجموعه سفارش نخواهم داد,SAD,1.0
مرغ بد بو، برنج له شده و خمیر، سیب زمینی سوخته. کیفیت غذاتون خیلی پایین بود,SAD,1.0
درحد قیمت خوب بود,HAPPY,0.0
چنتا از سفارشهام فرستاده نشد، چند کالا قیمتیکه روی کالا درج شده بود کمتر از قیمتی بود که توی اسنپ فود بود، چند کالای مصرفی نظیر شیر، شیر کاکائو، قارچ با انقضای لحظه اخری فرستاده شده بود با اسنپ فود تماس گرفتم پاسخ مناسبی به من داده نشد کلا اصلا راضی نبودم,SAD,1.0
بسیار بیات و بد طمع باعث شرمندگی من در مقابل مهمانم شد,SAD,1.0
هرچی قیمتارو میبرن بالا توضیحات مردم براشون بی ارزش میشه,SAD,1.0
برنج خوب ایرانی و زرشک فراوون، ممنون,HAPPY,0.0
