comment,label,label_id
قیمتش بالاست خیلیم فلفلیه ولی در کل راضی بودم!,HAPPY,0.0
خیلی سریع اومد واقعا ممنونم از پیک هم تشکر میکنم تا دم واحد اورد برامون,HAPPY,0.0
راضی بودم. Good Job,HAPPY,0.0
بنظر تازه نبود و بعضی از تارت‌ها دو تیکه شده بود,SAD,1.0
عااااالیییییی فوق العاده تازه و خوشمزه من که مشتری ثابت شدم,HAPPY,0.0
سلام، من لیموناد لیمو خواسته بودم، کوکاکولا فرستادید، عجله نکنید که زود انجام دادن کارها باعث بشه کاردرست انجام نشه، ۵ دقیقه اینور اونور زیاد فرقی به حال مشتری نمیکنه.,HAPPY,0.0
حجم غذا و کیفیت غذا خیلی پایین بود,SAD,1.0
شیرینی‌ها خیلی تازه و خوب بودند مخصوصا پای آلبالو که فوق‌العاده بود. ممنونم,HAPPY,0.0
خیلی عالی هم خوشمزه بود هم دیزاین زیبایی داشت مشخصه که از مواد اولیه خیلی خوبی تهیه شده بخصوص الان که همه جیز گرون شده و از هررستورانی مخصوصا برند غذا که میگیری با افت کیفیت روبرو میشی بهمه پیشنهادمیکنم تست کنند,HAPPY,0.0
خیلی خوشمزه بود و داغ …ممنونم.,HAPPY,0.0
گوشت غذا کاملا ترکیبی از سیرابی شیردون بود و شاید ۲۰ درصد گوشت داشت..,SAD,1.0
نان به موقع رسید بسته بندی عالی برخورد پیک عالی و نان هم بسیار عالی,HAPPY,0.0
واقعا با این رفتار خوبتون شرمندم کردید. من شیرینی دفاع فردامو با اطمینان از شما خریدم. ممنون از مدیرت که تماس گرفت و خیالمو راحت کرد که شیرینی تازه است. واقعا از پیگیریتون ممنونم. همچنین از کیفیت عالیتون که باعث شدید من واسه روز مهم زندگیم شیرینی فروشی شما رو انتخاب کنم. سپاس,HAPPY,0.0
خیلی زود آوردن و کاملا داغ بود. حجم غذا خیلی زیاد بود. کته‌اش خیلی عالی بود. میرزا قاسمشم خوشمزه‌ترین میرزایی بود که تو تهران خورده بودم. شامی چرب بود یه کم. اما ۳ تا شامی بود و کلی گوجه سرخ کرده.,HAPPY,0.0
از این بدتر نمیشد واقعا,SAD,1.0
مرغ سوخاری و سیب‌زمینی کاملا گرم و کمتر از نیم ساعت به دستمون رسید، فقط مرغ سوخاری بیش از حد سرخ شده و تقریبا روی سوخاری سوخته بود. ولی حجمش کاملا مناسب و سیب‌زمینی هم عالی بود. ممنون,HAPPY,0.0
واقعا بد بود، اگر نمیتونید مجبور نیستسد تخفیف بدید که بخواهید از کیفیت غذا کم کنید,SAD,1.0
برنج اصلا با کیفیت نبود. اما کبابش نسبتا خوب بود,SAD,1.0
تاخیر طولااااانی داشت و فوق العاده امت شرد بود برعکس همیشه متاسفانه,SAD,1.0
سیب زمینی با سس قارچ ااین مدلیههه؟ توش کلن ۲ دوتا سیب زمینی خورد شده با ۳ تا قارچ بد ۱۵ تومن؟,SAD,1.0
خوب و خوشمزه بود. نه سنگین بود و نه خیلی سبک,HAPPY,0.0
فوق العاده عالی فقط کاش برنج کمی بهتر بود. منکه هرروز سفارش میدم ازشون,HAPPY,0.0
در توضیحات غذا نوشتید سایز ۳۳ در ۳۳ ولی وقتی پیتزا رو تحویل گرفتم از کوچکی اون جا خوردم ۲۰ سانت به زور میشد خوب تو‌توضیحات سایز رو صحیح اعلام کنید,SAD,1.0
گوشت نیم پز و مانده، حدس میزنم پختش حداقل برای کی روز پیش هست، برنجش خوب‌بود!,SAD,1.0
واقعااااا عالی بود دمتون گرم حلالتون باشه,HAPPY,0.0
بى کیفیت‌ترین پیتزایى که یک رستوران میتونه تولید کنه پنیر بسیار چرب به صورتى که از پیتزا فقط روغن میچکید اصلا نتونستم بخورم کلا چهار تکه کوچک قارچ داشت کلى هم پول مالیات پرداخت کردم,SAD,1.0
عالی و بی نظیر …. کیک یزدی و شیرینی دانمارکی بقدری تازه وخوشمزه وعالی بودن … من از حدود بیست تاشیرینی فروشی کیک و شیرینی سفارش دادم واقعا میگم که از کیک وشیرینیهای آرسام بهتر وسالمتر جایی ندیدم …. دمتون گرم.. ممنون آرسام عزیزم موفق وپیروز باشید.. وهمیشه باهمین کیفیت درست کنید.. دست گلتون دردنکنه.. خداقوت,HAPPY,0.0
فقط شیرینی ناپلئونی به هم خورده بود ولی خوشمزه بود پای سیب هم تازه و عالی و خیلی هم سریع به دستم رسید. ممنون,HAPPY,0.0
ارسال فوق سریع ممنون,HAPPY,0.0
افتضاح بود، بوی خیلی بدی میداد و واقعا هم حجمش کم بود.,SAD,1.0
بسیار طعم بد داشت. مرغ سوخته که توی روغن دوباره سرخ شده است. کیفیت غذا به شدت پایین بود.,SAD,1.0
واقعا بد بود هرگز دیگه خرید نمی‌کنم,SAD,1.0
خیلی بیش از حد شیرین بود,SAD,1.0
جوجه خشک بود اصلا مزه جالبی نداشت من مشتری این مجموعه بودم اما دیگه کیفیت پارسال توش ندیدم,SAD,1.0
کیک سالم وبدون زدگی بود خیلی خوشمزه وتازه بود پیک هم به موقع اومد خیلی ممنون,HAPPY,0.0
طی دو روز گذشته از خرید از این ریتوران ناراضیم و طی تماس تلفنی با رستوران با طرز صحبت عجیبی رو به رو شدیم,SAD,1.0
با در نظر کرفتن تخفیف پاییزه، کیفیت سوپ افت کرده,HAPPY,0.0
کیفیت نان چیز برگر چندان خوب نبود و زود خرد می‌شد,HAPPY,0.0
پیک اسنپ خیلی خوب بود و خدا به کارشون برکت بده …با سپاس از سوپر مارکت و اسنپ فود,HAPPY,0.0
افتضاح بود اصلا پیتزا در حد شیلا نبود. واقعا این شعبش خیلی بی کیفیت شده. پیتزا که سرد بود و کیفیت پیتزای شعبات دیگرو نداشت. مثله پیتزا ۱۰ تومنیا بود متاسفانه نسبت به قیمتش نمی‌ارزید. ممنون از اسنپ فود,HAPPY,0.0
مسیری که پیاده ۲۰ دقیقه طول میکشه رو ۲ ساعت طول دادن!!!,SAD,1.0
سه تکه اسکلت مرغ سوخاری تحویل دادن بی نهایت بی کیفیت,SAD,1.0
بار اولی بود که سفارش میدادم از این رستوران. لازانیا خیلی خیلی معمولی بود. گوشت بو میداد. غذا فوق العاده چرب بود تا حدی که وقتی سرد شد دیگه نمیشد خوردش. کلا کیفت غذا بد نبود ولی اونقدرم خوب نبود که مجدد به این رستوران سفارش غذا بدم. حتی تو تخفیف ۳۰ درصد,SAD,1.0
باتشکر فقط قیمت‌هایی پیشنهادی گرون میباشد,HAPPY,0.0
من قارچ و مرغ سفارش دادم این فقط کالباس بود,SAD,1.0
ما به عشق نان‌های خوشمزه شما ساندویچ میخوریم اسنپ فود هم سریع و هالی و محترم,HAPPY,0.0
هم غذا خیلی خوشمزه بود و هم خیلی سریع رسید,HAPPY,0.0
به نظرم عالی و بی نظیر بود,HAPPY,0.0
راستش حیفم اومد نگم ک چقد رفتار پیکشون عالی و محترمانه بود. تایم ارسالشونم عالی بود واقعا. با اینکه من اشتباهی بجای جوجه، کوبیده سفارش داده بودماما تجربه خیلی خوبی شد کوبیدشون عالی بود حتما مجدد سفارش میدم. ممنون اسنپ فود ممنون تهیه غذای امیررصا دهقانی,HAPPY,0.0
واقعا برگرش خوش خوراک و میشه کلشچیش رو خورد و احساس سنگینی نکرد,HAPPY,0.0
اصلا تازه نبود خیلی بد بود,SAD,1.0
اول از همه ممنون از وقت شناسی که داشتن پیتزاش و سالاد ماکارانی عالی بود چیزبرگرش یکم نرم شده بود چون سس زیاد داشت در کل عالی بود,HAPPY,0.0
در قسمت توضیحات نوشته بودم که نوشابه قوطی چی باشه و بقیه جاهایی که سفارش میدادم همیشه بهش‌توجه میکردند و درست میفرستادن اما فست فود سیب به قسمت توضیحات سفارش توجه نکردن و نوشابه اشتباه ارسال شد,SAD,1.0
من قبلا ازتون پاستا خریده بودم چند بار با دوستام کلی راضی بودیم از مزه و بسته بندی و همه چیز! ولی الان دوبار هست که سفارش میدیم اون پاستای همیشگی نیست! آبدار و بی مزه … سفارش آخرم‌ بود,SAD,1.0
تازه و خوشمزه …,HAPPY,0.0
خیلی عالی دستتون درد نکنه. تازه وخوشمزه,HAPPY,0.0
غذا سرد بود آب کباب بهش ماسیده بود کبابش فوق العاده بد بود اصلا قابل مقایسه با سفارش قبلیم نبود انگار از یه کبابی تو میدون شوش خریدم خشک و سفت دیگه از این رستوران خرید نمیکنم,SAD,1.0
واقعا فکر نمیکردم مرغ سوخاری باگت اینقدر بی کیفیت باشه و دفعه آخری بود که از اینجا مرغ سوخاری سفارش میدم. یک خمیر خیلی ضخیم از آرد روی مرغ رو پوشونده بود و خود مرغ مغزپخت نبود و گوشتش تازه نبود و مزه موندگی میداد. به نسبت قیمت بالا انتظار کیفیت بیشتری داشتم,SAD,1.0
نان غذا بیات بود کل غذا فقط با نان گنده شده بود,SAD,1.0
بسیار شور و حجم بیکن بر استیک غالب بود. اما به موقع و داغ رسید. به علت نظرات مثبت زیاد سفارش دادم ولی پیتزاهای سایر رستوران‌ها رو ترجیح میدم,SAD,1.0
حجم غذا خیلی کم شده و خیلی چرب بودش,HAPPY,0.0
Faghat sham baram ye chize dge ferestadid oni ke mikhastam nabod motasefane,HAPPY,0.0
یعنی باروژ خیلی ضعیف شده پیتزای مرغش که مونده بود قشنگ حالم بد شد واقعا متاسفم,SAD,1.0
خوب نبود کاهو‌ها تلخ و پلاسیده بود همچنین من ساندویچ با نان جو سفارش دادم با نان باگت معمولی آوردن,SAD,1.0
یکبار قبلا خورده بودم ساندویچ ژامبون ویژه رو خیلی بهتر بود. این سری تقریبا هیچی چیپس نداشت.,HAPPY,0.0
میل همیشه سریع و به موقع بود,HAPPY,0.0
غذا به موقع تحویل شد. پیتزا صبحانه بد نبود، ولی ساندویچ‌های صبحانه به شدت خشک و مونده بودن و طعم خوبی هم نداشتند.,SAD,1.0
عالی عالی. با رضایت کامل نمره پنج دادم,HAPPY,0.0
آب هویج گرم بود و هم شیک هم آب هویج کلا ریخته بود، آب هویجم انگار یه بار جوشیده بود بعد ریخته بودن تو لیوان، نصفش که ریخته بود، نصف دیگشم انقدر گرم بود خودم مجبور شدم بریزم دور,SAD,1.0
واقعا خوشمزه و عالی بود، ممنون و سپاسگزارم,HAPPY,0.0
شاید تو نگاه اول قیمت بالای غذاها یکم عجیب باشه ولی با توجه به کیفیت بالا و حجم زیاد غذا این قیمت کاملا مناسبه، برنجشون ایرانیه و گوشتشون درجه یکه، برخورد پیک و عوامل رستوران هم خیلی عالیه، شدیدا توصیه میشه,HAPPY,0.0
خیلی خوب بود و به موقع هم رسید. ممنون,HAPPY,0.0
مثل همیشه سریع و عالی و با کیفیت. ممنون,HAPPY,0.0
حتما کوکی اش رو امتحان کنید طعم شیرینی خونگی میده,HAPPY,0.0
قیمت ساندویچ نسبت به حجم خیلی خیلی بالا بود. تو ساندویچ مخلوط از هر ژانبون ی ورق گذاشته بودین. در کل راضی نبودم. نصف باگت ۲۱۰۰۰ تومن؟؟؟؟؟؟؟,SAD,1.0
نسبت به قیمت حجمش کم بود,HAPPY,0.0
همه چی تازه و سریع ممنون,HAPPY,0.0
زمان سفارش یک ساعت و ۳۳ دقیقه تا تحویل طول کشید. غذا سرد سرد. یعنی دفعه اول و آخرم بود سفارش دادم,SAD,1.0
همه چیز عالی بود. من برام خیلی مهمه مرغ خوب سرخ شه. خوب سرخ شده بود فقط اگه بیشتر مغز پخت میشد بهتر بود یذره مرغش جا داشت بیشتر بپزه. مخلفات عالی بود. داغ بود. برنجشم حرف نداشت.,HAPPY,0.0
سلام و خسته نباشید. بسیار گرم و تازه بدستم رسید. فقط بار دوم نون خوب بسته بندی نشده بود. ممنونم,HAPPY,0.0
کیفیت رستوران و نوع بسته بندی نشان از احترام رستوران به مشتری داشت، از اسنپ فود هم ممنونم که انقدر زندگی رو دلپذیر کرده برامون,HAPPY,0.0
از هانی انتظار نداشتم. قرمه سبزی لوبیا نداشت. طعم گوشت خوب نبود. قیمه هم بادمجان سرخ نشده و گوشت بوی چربی میداد یه خورشت وارفته,SAD,1.0
دو تا از پیتزاها سوخته بود,SAD,1.0
سلام برخورد پیکی که ارسال کردید خیلی نامحترمابه و بی ادبانه بود. لطفا پیگیری بفرمایید.,SAD,1.0
در کل خوب بود اما غذا‌ها یکم سرد بود اونم به خاطر تو راه بودن به هر حال مثله اینکه تو رستوران باشی نمیشه اما خوب کیفیت پیتزا چانو میتونست بهتر باشه,HAPPY,0.0
عالی بود پخت برنج جوجه به اندازه پخته شده بود نه کم پخته بود نه زیاد که یا بسوزه او‌خشک‌باشه نه نپخته باشه و اینکه خوب مزه دار شده بود زکان ارسال اشم عالی بود غذا هم‌گرم بودش تشکر از مدیریت,HAPPY,0.0
مثل همیشه عاااااالیییی. متشکرم,HAPPY,0.0
کیفیت پیتزا این رستوران دیگه اصلا مثل سابق نیست. اصلا خوب نبود,SAD,1.0
زرشک پلو با مرغ یعنی مرغ و پلو بعلاوه زرشک، برای من بجای زرشک زحمت کشیدن و قارچ گذاشتن، مرغ و قارچ سفارش ندادم که.,SAD,1.0
خیلی خیلی تاخیر داشتید.,HAPPY,0.0
زمان تعیین شده و رسیدن به دست ما درست بود - طعم جوجه‌ها خوب بود و اندازه ش کافی بود - سپاس,HAPPY,0.0
Nooshabeye yeki az ghazaha gozashte nashode bod,SAD,1.0
نونش تازه و خوب بود، ولی پنیرش خیلیییی کم بود و دو برگ سبزی هم کنارش کاش پنیر و سبزیش هم مثل توی عکس، زیاد میذاشتین,SAD,1.0
من همیشه از این رستوران خرید میکردم جدیدا کیفیت غذاهاش ضعیف شده، در ضمن پیتزا سرد بود.,SAD,1.0
بستنی را نفرستادن یا نیاوردن تماس گرفتن ۳۰ دقیقه منتظر شدم اما نگار نه انگار,SAD,1.0
غذا زود رسید و گرم بود، کیفیت غذا راضی کننده بود و سرویس خوب بود، ممنونم از مدیریت رستوران,HAPPY,0.0
In keyk vaghean khoshmazast vali eshkal az snape k dir miare,HAPPY,0.0
من مشتری همیشگی شعبه سعادت آباد و پاسداران باگت هستم و مشتری پرو پاقرص پیتزا سیرو استیک و رست بیف که حدودا ۱ سال هست اضافه شده به منو. اونجا که بینهایت راضی هستم. مال شعبه بلوار فردوس هم خوب بود ولی واقعا نمیشد با پیتزا رست بیف سعادت آباد مقایسه کرد. همون شکل و همون مواد بود به استثنای اینکه در شعبه سعادت آباد از یه قارچهای خاصی غیر از قارچهای معمول استفاده میکنن در این پیتزا که خیلی خوشمزه و لذیذه که در این سفارش من از این شعبه بلوار فردوس نبود. در کل من راضی بودم. خیلی سریع غذا داغ به دستمون رسید. و امیدوارم به زودی به کیفیت شعبه سعادت آباد و پاسداران برسه,HAPPY,0.0
سفارش بصورت کامل تحویل نشد ولی فاکتور شد,SAD,1.0
مثل همیشه عالی تازه و بسیار به موقع خیلی ممنون از زحماتشون,HAPPY,0.0
مقدار سس کم بود,HAPPY,0.0
عالیه، همه چیزش ساندویچش عالیه، تا حالا ۱۵ تا ازش گرفتیم همیشه خوب بوده,HAPPY,0.0
سلام ایندفعه بهتر بود تشکر,HAPPY,0.0
پرپروک برای پیتزا هاش سس مخصوص داره … حالا سس مخصوص پیشکش لااقل چندتا دونه سس معمولی میذاشتید … پیتزا سرررررد هم نخورده بودیم که خوردیم … واسه برند پرپروک جای تعجب داشت …,SAD,1.0
مثل همیشه عالى بود اشتباه زدم ناراضى هستم. مشترى پر پا قرض باکت هستم,SAD,1.0
گفته بودم سس مخصوص خودشون و بزارن چرا نزاشته بودن؟ از کیفیت پیتزا راضی ام ولی یع کاردو چنگال نمیزارن کنارش و سس و از سسهای ترکیبی خودشون بزارن بهتره یکم انتظار دارم پیتزا سیب به این چیزا توجه کنه,HAPPY,0.0
به نظر من بهتر از ماهک نیست تو این محدوده …واقعا عالی هستید..,HAPPY,0.0
غذا سرد تحویل داده شد و حجم سالاد خیلی خیلی کم بود,SAD,1.0
قیمت خیلی مناسب و کیفیت خیلییی خوب ممنونم,HAPPY,0.0
خیلی عالی. البته به نظر من دیگه روی نون پنیر نریزید خیلی چرب می‌شه. یه کاری کنید بشه بیش از یک بار در سال ازینا سفارش داد! =))),HAPPY,0.0
بعد از دوبار اعلام تاخیر و بیشتر از یک ساعت و چهل دقیقه، غذای سرد با نوشابه گرم تحویل دادند. چلوی اضافه هم روی ماهی سرخ شده ریخته شده بود! فقط میتونم بگم متاسفم …,SAD,1.0
واقعا بی مزه بود و اصن مزه خوبی نداشت. سه مدل مختلف که یکیش مزه زنجبیل داشت که واقعا بد طعم بود و دو مدل دیگه هم کاملا خنثی. در ضمن خیلی کوچیک بودن و اصن نسبت به قیمتش به صرفه نیس. من که خوشم نیومد,SAD,1.0
عااالی، واقعا لذت بردم نون تازه، خوش طعم و قیمت مناسب,HAPPY,0.0
با اینکه من از مشتریهای همیشگیتون هستم ولی ایندفعه واقعا ناراضی هستم، نان خامه‌ای ارسالیتون واسه دیروز یا پریروز بوده، این نظر من تنها نبود، نظر بقیه همکارانم که از شیرینیتون خوردن هم بود، امیدوارم دفعه بعدی که سفارش میدم این مشکل پیش نیاد,SAD,1.0
ممنون که به موقع رسوندین و پیگیر بودین,HAPPY,0.0
متاسفانه با اینکه خیلی تحویل غذا طول نکشید اما کاملا سرد بود.,SAD,1.0
کروسان بیات و خیلی خشک بودند و اصلا قابل خوردن نبودند,SAD,1.0
بسیار عالی، سریع ارسال شد,HAPPY,0.0
غذاشون با کیفیته و تقریبا همیشه به موقع تحویل میدن,HAPPY,0.0
کیک عالی، متاسفانه ۱ طرف کیک ضربه‌ی کوچکی تو حمل خورده بود,HAPPY,0.0
راضی بودم.. سایز وکیفیت متناسب با قیمت.,HAPPY,0.0
بار سوم از لسنپ فود غذا سفارش میدم قاشق چنگال نمیزارن,SAD,1.0
طعم خوب، بسته بندی خوب … اما کاملا سرد,HAPPY,0.0
دفعه‌ی قبل که همین سفارشو دادم کیفیت ساندویچ خیلیی عالی بود. ولی این دفعه متاسفانه اصلا خوب نبود به خصوص اسفناجش. لطفا کیفیت خوبتونو حفظ کنید,SAD,1.0
پیتزا تقریبا سرد بود حجم مواد مصرفی کم پنیر فوق العاده کم و نسبت به پولش اصلا نمی‌ارزه,SAD,1.0
غذاعالی بودسپاسگذارم کیفیت بی نظیر,HAPPY,0.0
دمتون گرم، مثل همیشه ساندویچ خوشمزه بود و بموقع دستمون رسید. تشکر,HAPPY,0.0
برام خیلی عجیبه. توی سال جدید به نظر میاد آلپارو کلا تغییر کرده. شاید هم سرآشپزتون تغییر کرده. حجم غذا‌ها نصف شده. پیتزا هم خیلی کم حجم شده بود هم مخلفاتش خیلی کم شده بود و هم مزه‌اش کاملا با همیشه فرق داشت. بارها از شما سفارش گرفتم و راضی بودم. متاسف شدم که یه رستوران خوب رو از دست دادم و دیگه سفارش نخواهم داد.,SAD,1.0
سفارش دیر رسید. ولی کیفیت غذا خوب بود. برخورد پیک خیلی خوب بود,HAPPY,0.0
خیلى غذاى بدى بود. با وجود اینکه قبلا از شعبه صادقیه همین غذا رو گرفته بودیم و خیلى هم خوب بود اما این بار اصلا راضى کننده نبود,SAD,1.0
یعنی مثل همیشه تازه و خوشمزه و به موقع,SAD,1.0
کیفیت بشدت افتضاح نون باگت اینقد خشک و مونده بود که سریع خورد میشد دیگه از این رستوران خرید نمیکنم,SAD,1.0
متاسفانه به جای پیتزا کالزون که سفارش داده بودم پیتزا گوشت و قارچ تحویل دادن و چون دیروقت بود از خود رستوران پیگیری نکردم. از خمیر پیتزا هم مشخص بود که مال چند ساعت پیشه. من به شخصه خیلی دوست دارم این رستوران رو ولی امشب اصلا مناسب نبود.,SAD,1.0
خوب بود ارسال ۱۲ شب هم از نکات مثبت ش بود,SAD,1.0
مرغ کمی بو میداد نون چرا انقدر بزرگه؟! خوردنش خیلی سخته! سسش هم اگر شیرینی کمتری داشته باشه بهتره,HAPPY,0.0
دیر و سرد و اینکه سس خیلى کم گذاشته بود,HAPPY,0.0
خوب بود بابت ارسال به موقع و گرم رسیدن غذا همین طور سوپ خوشمزه تون ممنونم,HAPPY,0.0
شیرینی تازه نبود هم کیک زدی هم سپهسالاری مونده بود و طعمش هم اصلا خوب نبود,SAD,1.0
برگر بیش از حد تند بود. استفاده بیش از حد از ادویه معمولا با هدف کاور کردن کیفیت پایین غذاست. در حالیکه کیفیت خود ساندویچ واقعا قبول بود و فقط تندی بیش از حدش اجازه نمیداد از طعم غذا لذت ببری.,HAPPY,0.0
عالی! هم سریع و گرم رسید و برخورد پیک خیلی خوب بود، هم غذا خیلی خوشمزه و با کیفیت بود. لذت بردم. ممنون,HAPPY,0.0
موس شکلات‌ها بسیار بد و مانده (کهنه) بود,SAD,1.0
واقعا ایم مدل رولتتون خیلی خوشمزش فقط اندفعه‌ی دونه کمتر گذاشته بودید و به جاش دو سه تا از اون رولت معمولیا گذاشته بودید,HAPPY,0.0
خیلی تازه و خوشمزه بود خامه خیلی زیادی هم نداشت و کاملا سالم به دستمان رسید ممنون از شیرینی لادن و اسنپ فود,HAPPY,0.0
جوجه‌ها قسمت سینه مرغ خیلی سوخته بود، نمیدونم چرا. تا قبل که سفارش میدادم این شکلی نبود. حتی عکس هم گرفتم ولی نمیشه اپلود کرد.,SAD,1.0
