comment,label,label_id
بسیار عالی تازه خوشمزه بودند ولی عکس بربری کره‌ای با اون مدلی که برای من فرستاده شده بود متفاوت بود!,HAPPY,0.0
متاسفانه همیشه سفارش من از این رستوران با تاخیر میرسه,SAD,1.0
پلو ته دیگی حجم بسیار کم و برنج با خورده ته دیگ آورده بودند خیلی خیلی بد ته چین، مرغ بسیار کم و خمیر و بد مزه قیمه هم اصلا خوب نبود سالاد سزار چند تکه کوچک مرغ خورد شده و ته ظرف آب کاهوها جمع شده بود,SAD,1.0
بورک‌ها به شدت شوررررررر و بسیار زیاد چرب، اصلا خوشمزه نبودن. پواچا هم اصلا جالب نبود-امکان نداره دوباره خرید کنم-حیف پول,SAD,1.0
همه چی عالی برخورد پیک عالی‌ ممنون بابت همه چی,HAPPY,0.0
بسیار خوب، پیک هم بسیار محترم,HAPPY,0.0
هروقت پیراشکی سفارش دادم تازه نبوووووووووده,HAPPY,0.0
ما همیشه باروژ رو انتخاب میکنیم چون واقعا با کیفیت و خوشمزس,HAPPY,0.0
با اینکه در جواب نظرها نسبت به حجم کم مینویسید: مقدار استفاده شده استاندارده ولی واقعا یه نون و پنیر که شباهتی به عکسش هم نداره با چه استانداردی درست شده؟ از کدوم استاندارد حرف میزنید؟ اعتبار خودتون رو خراب نکنید,SAD,1.0
بسیار خوب البته احتمالا از نظر خودشون همونطور که توی توضیحات لارج سالاد بود دو دونه کرنبری داشت بدون فلفل یه تیکه اندازه گیلاس بروکلی گداشتن. یک دونه بادوم نصف یک لیمو ترش خشک و دو پر ریحان. میشد بهش گفت اسمال سالاد نه لارج سالاد۳۲ هزاد تومن هم بابتش پول میگیرن,SAD,1.0
پاستا با سس پستو خیلی خوب بود و طعم متفاوتی داشت در مقایسه با پاستا با سس بلونز که همان ماکارونی خودمون بود و چیز خاصی رو احساس نکردم تو مزه‌اش,HAPPY,0.0
ذرت‌های سالاد فصل خیلی سفت بود,SAD,1.0
شوکت طعم خیلی خوبی داشت:),HAPPY,0.0
یک ساعت بعد از تحویل گرفتن غذا، بدست من رسید، و غذا کاملا سرد بود،,SAD,1.0
اگر بین کیک، قطعات موز هم گذاشته میشد عالی بود,HAPPY,0.0
نمیدونم داخل پیتزا از چه مواردی استفاده شده ولی من هنوز ساعتها بعد از خوردنش حال تهوع و سرگیجه دارم.,SAD,1.0
واقعا مزخرف بود … یک ساعت و چهل دقیقه طول کشید که غذا به دستم برسه و وقتی هم رسید سرد بود … واقعا متاسفم هم برای رستوران که دیگه به هیچ عنوان ازش غذا نمیگیرم و هم برای اسنپ فود,SAD,1.0
شیر و ماست تاریخشون خیلی قدیمی بود شیر ٢ روز از تاریخش مونده بود و ماست ٦ روز به نظرتون یه سطل ماست ٦ روزه تموم میشه یا شیری که روزانه براتون میاد رو چرا نگه میدارین و اونایی که باید مرجوع کنید به مشتری میفرستین؟,SAD,1.0
جوجه‌کباب هاش‌بسیار‌عالیه طعم فوق العاده‌ای داره مخصوصا وقتی برشته باشه,HAPPY,0.0
پیتزای آمریکن خیلی خیلی شور بود,HAPPY,0.0
واقعا عالی بود مثل همیشه خوش مزه و مواد تازه استفاده شده بود,HAPPY,0.0
غذاش زود اومد حدوا بیست دقیقه ولی سرد بود بود و کتفش هم خیلی کوچک بود و طعم خاصی نداشت,SAD,1.0
بموقع و داغ رسید,HAPPY,0.0
مثل همیشه عالی بود ممنونم شب بخیر,HAPPY,0.0
عالی بود ولی نمیدونم چه جوریه از هشت صبح تا هشت شب کیک هویج تمام شده است,HAPPY,0.0
بدترین غذایی که خوردم,SAD,1.0
فقط خمیر بود اسمشو پیتزا خمیر بزارین بهتره,SAD,1.0
بار اول فکر کردم شانسی اینقدر شوره ولی انگار دستتون به نمک زیاده! و کیفیتش نسبت به قیمتش بد نیست,SAD,1.0
مرغ سفت بود پخته نشده بود,SAD,1.0
پیتزاهای سیب واقعا عالی هستن، دمتون گرم,HAPPY,0.0
تعداد شیرینی‌ها ۱۲ عدد بود چرا حدود ۲۰ عدد ذکر شده بود,HAPPY,0.0
بسیارعالی و پر ملات. از معدود برندهایی که کیفیت را درتمام این سالها حفظ کرده.,HAPPY,0.0
غذاها همگی خوشمزه و لذیذ بود، ولی فقط با فاصله نزدیکی ۱۰ دقیقه پیاده روی که با رستوران داریم، ۱۴ هزار تومان هزینه پیک گرفته شد و حدود ۶۰ دقیقه زمان برد تا سفارش را به ما برسانند و غذا سرد شده بود. پیک بسته سفارش دیگری هم همراهش بود، یعنی پول پیک را از چند سفارش میگیرنند ولی باهم ارسال میکنند که جای تاسف است!!! هزینه پیک هم با این فاصله نزدیک خیلی زیاد و گران است.,HAPPY,0.0
پیتزا استیک خوب بود. البته مقدار پنیر پیتزاها یه مقدار کمه. ولی طعم استیک خوب بود. زمان تحویل هم زیر ۳۰ دقیقه و غذا گرم بود.,HAPPY,0.0
خیلی خیلی بو میداد گوشتش و خوشمزه نبود,SAD,1.0
متاسفانه فست فود شیلا بعد از جذب مشتری قیمت غذاهاشو نامتناسب با کیفیت و حجم بالا برد و همیشه هم هزینه پیک و مالیات رو روی فاکتورش اضافه میکنه که در نتیجه منطقی به نظر نمیرسه.,SAD,1.0
از اسنپ سپاسگزاریم بخاطر اینکه نانوایی سنگک وسک را که یکی از بهترین نانواییهای منطقه است را به همکاری دعوت کرده …ما از سال ۹۴ از این نانوایی خرید میکنیم و همیشه از کیفیت عالی نان ان راضی بودیم. سپاس از کارکنان این نانوایی,HAPPY,0.0
معمولی بود و گرون,HAPPY,0.0
غذا با کیفیت عالی و داغ رسید. مرسی از پیک اسنپ فود,HAPPY,0.0
کیفیت ماهی تون به شدت افت کرده!!! قبلا اصلا اینجوری نبود! ولی جوجه کباب فسنجونی خوب بود اگه اینم تا چند وقت دیگه کیفیتش خراب نکنید!!!,SAD,1.0
پوره سیب زمینی مزه عالی داشت قارچ برگ هم خوب بود,HAPPY,0.0
غذا خوشمزه بود، بسته بندی هم عالی بود اما حجم گوشت و سیب زمینی و نخود به نسبت رستورانهای مشابه و قیمت غذا واقعا کم بود، من که کم غذا هستم سیر نشدم.,SAD,1.0
اگر همین قیمت و کیفیت حفظ کنید بی شک جزو اولین‌ها هستین. دمتون گرم,HAPPY,0.0
هرچی از کیفیت و طعم پیتزا باروژ بگم کم گفتم. فوق العاده لذیذ، سبک، گرم و تازه بود و سس سیر هم حرف نداشت یکی از بهترین پیتزاهایی که تو عمرم خوردم,HAPPY,0.0
کیک عالی بود فقط هزینه ارسال دیشب دو هزار تومن بود ولی الان شده به ۵ هزار تومان رستوران هایی هستند که توی پاسداران هستند ولی ولی هزینه تحویل آنها ۲ هزار تومان است ولی این کیک فروشی دقیقه خیابون روبروی خونه ما میشه و ۵ هزار تومان قیمت هزینه ارسال شده بود لطفا پیگیری کنید,SAD,1.0
غذا خوب بود. حجم اش خوب و کیفیت اش هم خوب بود. سالاد رو هم دوست داشتم,HAPPY,0.0
هم حلیم و هم عدسی معرکه و داغ بود از ظروف گیاهی که با حرارت غذا مشکل ندارند هم استفاده شده بود.,HAPPY,0.0
سیب زمینی همراه کباب بختیاری، چیپس آماده بود.,SAD,1.0
یدفعه بنویسید نون و سوسیس سرخ کرده و رب بجای پیتزا,SAD,1.0
من ۲ نوبت به این رستوران سفارش دادم که همه چیز خیلی عالی بود.,HAPPY,0.0
بسته ارسالی نه تاریخ تولید داشت نه وزن و مزه موندگی میداد از تواضع انتظار نداشتم,SAD,1.0
غذا سرد ه سرد بود وکاملا مشخص بود غذا حاضر بوده و مدت زیادی طول کشیده تا تحویل شود ضمنا فاصله رستوران تا منزل ما کمتر از دو دقیقه است,SAD,1.0
بد نبوود کیفیتش قبلا خیلی بهتر بوود,HAPPY,0.0
اسم این غذای جدید رو بگذارید، خورشت لپه با برنج! دو تا تیکه دقیقا اندازه بند انگشت، فقط گوشت داشت. متاسفم واقعا. ۱۵ هزار تومان پول برنج و لپه دادم فقط.,SAD,1.0
کیفیت کبابش خوب نبود برنجش دم نکشیده بود دل درد گرفتیم,SAD,1.0
معجون انارش مثل همیشه خوشمزه بود ولی ویتامینشو اصلا مزشو دوست نداشتم و اینکه اگه زودتر ارسال کنند که اینقدر بستنیا اب نشه خیلی بهتره این سری ارسال خیلی طول کشید,SAD,1.0
زرشک پلو با مرغ عالی,HAPPY,0.0
امروز اصلا مثل همیشه نبود. خیلی بی مزه بود غذا. سیب زمینی بو میداد و سسم مزه همیشه نبود,SAD,1.0
ما مشتری قدیمی هات‌چیکیم اما متاسفانه کیفیتش چند وقته افت کرده … هم پیتزاش بد بود هم ساندویچش … راضی نبودیم در کل,SAD,1.0
کیفیت ته چین مرغ خیلی خیلی پایین و بد بود,SAD,1.0
خوشمزه و دلچسب … جای همه شکم بازا خالی,HAPPY,0.0
بر خورد پیک بد بود ساندویچ رست بیف هم طعم تازگی رو نداشت,HAPPY,0.0
پیتزای ۳۰ سانتی سفارش دادم، ولی ۲۴ سانتی آوردن,SAD,1.0
سلام خسته نباشید مسواک اورال بی سافت سفارش دادم عکس محصول زده بود سافت ولی مدیوم فرستادید.,SAD,1.0
سیگار رو اشتباه فرستادن,HAPPY,0.0
با کلى ذوق سفارش داده بودم وقتى خوردم دیدم کاملا کهنه بود واقعا خوب نبود فقط تونستم به زور یه کم ازش بخورم,SAD,1.0
Roletha ba dchide shode budan besiar feshordeh,HAPPY,0.0
من رولت ناپ-ن-ن سفارش داده بودم ولی متاسفانه کیک مکزیکی فرستادن. کمی هم بیشتر از انتظارم طول کشید. در این موارد باید تماس بگیرن و بگویند فلان شیرینی را تمام کردیم نه اینکه سرخود چیز دیگری بفرستند.,SAD,1.0
پنیر پاک بوی خیلی بدی میداد,HAPPY,0.0
مرغش به نسبت عکسی که گذاشتن خیلی کم بود,SAD,1.0
قرمه سبزی با مرغ؟ بسیار گرسنه بودیم و مجبور شدیم بخوریم و الا واقعا جای تاسف داره حداقل اینکه رستوران باید به مشتری بگه، نه اینطور,SAD,1.0
خیلی خوب بود اما کم بود.,HAPPY,0.0
متاسفانه شیرینی که خواسته بودم رو نفرستادن و از شیرینی هایی که برخلاف سفارشم بود و موجود داشتن ارسال شده بود واقعا تو ذوقم خورد وقتی در جعبه رو باز کردم، دیگه سفارش نمیدم,SAD,1.0
عالی بود و به موقع رسید با تشکر,HAPPY,0.0
برنج غذا شفته شده بود,HAPPY,0.0
عالی و خیلی خوب بود غذاشون,HAPPY,0.0
کباب ترکی‌ها پر از روغن (درحدی که چکه میکرد از نون و حتی نون هم از روغن زیاد له شده بود) تمام غذا‌ها شدیدا سرد شده بود و خودمون گرم کردیم,SAD,1.0
تاریخ شیر تازه نبود فاکتور نداشت,SAD,1.0
بسیار شور و پر نمک بود مخصوصا سیب زمینی خوش مزه است ولی شور و مضر,SAD,1.0
سوپر عالی پیک عالی,HAPPY,0.0
از پیتزا راضی نبودم خیلی خشک و برشته شده بود,HAPPY,0.0
بسیار خوشمزه بود و خیلی هم زود رسید به دستمون. سس مخصوص هم عالی بود,HAPPY,0.0
کیک نااااااابود رسید دست من و کل برنامم بهم خورد کیک واقعا بهم ریخته و بد بود,SAD,1.0
بستنی عالی بود وسرعت رسیدن سفارش هم بالا بود ممنون,HAPPY,0.0
غذای فوق العاده با کیفیت و خوشمزه بود و داغ و تازه بود و کاملا به صرفه بود. حتما پیشنهاد میکنم.,HAPPY,0.0
سری اول سفارش دادم خوب بود ولی اینسری که به دستم رسید معجون آبه آب شده بود که ۲-۳ ساعت گذاشتیم فریزر تا خودشو بگیره,SAD,1.0
تاریخ سیگار‌ها خیلی وقت بود از تولیدش گذشته بود وخیلی بد بود,SAD,1.0
غذا سرد بود. برنج کمی شفته بود وجوجه ترش سفت بود … یه مزه‌ی بخصوصی هم می‌داد که اصلا سلیقه‌ی من نبود. در کل قطعا آخرین خرید من از این رستوران خواهد بود,SAD,1.0
هر روز بدتر از قبل,SAD,1.0
همبرگر کوچک و سوخته بود. سیب زمینی بدلیل کهنه و مونده رودن اصلا طعم نداشت. قیمتها هم بالاست.,SAD,1.0
خیلی خوشمزه و عالی بود. حجم و قیمتشم خیلی خوب بود. پیک محترم و خوش اخلاقی هم داشتن. دستتون درد نکنه,HAPPY,0.0
قیمت‌ها و زمان تحویل خوب بود. خیلی سریع اوردن. فقط یه مدل بستنی رو اشتباه ارسال کرده بودند,HAPPY,0.0
یک پیتزا اشتباه آورد، بعد از نیم ساعت پیک اومد و پیتزا رو برد، نیم ساعت بعد پیتزای بعدی رو آوردن که سرد بود! مشخصا پیتزای من هم اشتباهی جای دیگه‌ای رفته بود که به شدت مشکل بهداشتی داره! من چجوری اعتماد کنم به این غذا!؟,SAD,1.0
مواد استفاده شده تازه و خوب و خوشمزه و مرغ طعم دار عالی کرن بری به اندازه کافی خلاصه خوب,HAPPY,0.0
همه چیز خوب بود متشکرم,HAPPY,0.0
عالی، خوشمزه. خیلی زود هم به دستم رسید. مرسی,HAPPY,0.0
خوشمزه بود ولى خیلی سرد بود,HAPPY,0.0
سیب زمینی ویژه واقعا خوشمزست به خاطر پنیرش. اما اگه یه کم خوش نمک‌تر درست بشه که دیگه عالی‌تر هم میشه.,HAPPY,0.0
غذا یخ بود و کیفیت غذا نسبت به قبل پایین بود,SAD,1.0
خیلی عالی و خوشمزه بود ممنون.,HAPPY,0.0
ممنون از هماهنگى شما,HAPPY,0.0
کیفیت عالی ولی سرد بود,HAPPY,0.0
شامپو بدن ارسال نشده است.,SAD,1.0
شیرموز تون عالی بود حرف نداشت.,HAPPY,0.0
شیرینی دانمارکی تازه نبود، مانده بود و متاسفم … …,SAD,1.0
با سلام قیمت متناسب نبود خوب نیست که قیمت الکی بالا اعلام و سپس تخفیف دهید,SAD,1.0
غذا نسبت به قیمت کیفیت مناسبی داشت فقط حجم برنجش خیلی زیاد بود نسبت به جوجه حجم برنج کمتر کنن و قیمت یا کیفیت جوجه رو ببرن بالا خیلی بهتره,HAPPY,0.0
هر دو تا پیتزا هم بد بو و هم بد مزه بودن طوری که بعد از اینکه ۲تیکه ازش خوردیم بقیشو ریختیم دور، لطفا کیفیت گوشت و سس پیتزاهاتونو بهتر کنین چون واقعا قابل خوردن نیست.,SAD,1.0
بسیار وقت شناس هستند,HAPPY,0.0
خوبه. فقط وقتی ی جنسی تموم میشه زنگ میزنن اعلام میکنن و جنس جایگزین انتخاب میکنیم برامون نمیفرستن,HAPPY,0.0
به جای پودر ماشین لباسشویی، پودر دستی فرستادن.,SAD,1.0
پیک عالی بسیار گرم با بسته بندی مناسب اما هزینه پیک با توجه به مسافت کم هیچی، هزینه مالیاتشونم ما باید بدیم؟؟؟!!! مخصوصا که هرگز همچین میگو سوخاری بی کیفیتی نخورده بودم بیشتر پودر سوخاری بود تا میگو واقعا خجالت آوره,SAD,1.0
کیفیت نان بسیار خوب بود.. نان محلی رو بیشتر دوست داشتیم.. ممنون,HAPPY,0.0
من ویتامینه مخصوص سفارش دادم ولی رویال اوردن. با اینحال خوشمزه بود. راضی ام,HAPPY,0.0
سریع و خوشمزه بود مرسی,HAPPY,0.0
خیلی خوب بود، نه خمیر و نه سوخته، برشته و خوشمزه، بود,HAPPY,0.0
خوب بود ولی خب یکم گرون,HAPPY,0.0
کیفیت پرپروک خیلی افت کرده خیلی زیاد طوری که من تا چند ماه پیش بنظرم پرپروک جرو بهترین رستوران‌ها بود ولی الان خیلی کیفیت اومده پایین مواد روی پیتزا خیلی نسبت به قبل کمتر شده و من دیگه هیچ وقت از پرپروک سفارش نمیدم,SAD,1.0
همه چیز خوب فقط خیلی دیر رسید ممنون,HAPPY,0.0
من پاستا سفارش دادم پاستاش واااااقعا افتضاح بود ماکارونی ابکش شده بود بعلاوه چند تیکه زیتون و یکم مرغ ن طعمی ن مزه‌ای هیچی اخرین باری بود ک سفارش غذا میدم از اینجا,SAD,1.0
پیکش یه کمی خسته بود,SAD,1.0
فقط تاخیر تو سرویس غذاش عالیه,HAPPY,0.0
برخورد پیک بسیار محترمانه بود. من شرمنده میشم چنین جوان‌هایی در پیک کار می‌کنند.,HAPPY,0.0
فوق العاده غذاشون چرب بود جوری که نتونستم بیشتر از چند قاشق بخورم.,HAPPY,0.0
کباب بو میداد، برنج هم شفته بود. مخلفات داخل عکس، کنارش نبود,SAD,1.0
پلاچنتا خیلی فوق العادس و شیرینی سالمی هست. کیک نرمال بود.,HAPPY,0.0
خوب بود غذا به شرطی که با جای دیگه مقایسه نشه,HAPPY,0.0
نوتلا نبود شکلاتی بود,HAPPY,0.0
پیتزایی که تو عکس منو هست هیچ ربطی به پیتزای ارسالی نداره: ((,HAPPY,0.0
همه چی عالی بود و به موقع هم رسید ممنون!,HAPPY,0.0
سس کره بیش از حد بود وبسیار چرب,SAD,1.0
برنجش خوب بود ولی مرغش خیلی سفت بود و یه بویی بدی هم میده. درصورتی که من دیروز از این رستوارن غذا گرفتم خیلی خوب بود و مجبور شدم بخورم چون تایم نداشتم که برگشت بزنم,SAD,1.0
بالای دوساعت طول کشید تا همین یدونه رو بیارن خیلی سرد بود انگار از توی یخچال یه نون لواش در اورده بودن و روش پنیر ریخته بودن,SAD,1.0
اگر میخاهید ساندویچ کاهو بخورید ازینجا خرید کنید هشتاد درصد حجم ساندویچ ش کاهو بود، چیدمان موادشم داغون بود,SAD,1.0
سلام خسته نباشید الان تو هر سوپرمارکت همه رقم نون هست اگه سفارش میدیم برای تازه بودن نونه. اگه شما هم نون رو داغ داغ روهم بیچینیدچند ساعت بعد خمیر و بیات بفرستید میشه همون موفق باشید شد بفرستید,SAD,1.0
واقعا افتضاح بود! حیف پول! پیتزا از مواد بی کیفیت تهیه شده بود! معلوم بود مونده بود! به هیییچ عنوان دیگه از این رستوران سفارش نمیدم حتی اگه از گشنگی بمیرم یا حتی رایگان باشه!!! تاسف برای مدیر این فست فود!!! درک نمیکنم چطوری واقعا یه سری از افراد میان تعریف میکنن و میگن عالی بود پیک که هم انگار یوبس بود حتی جواب سلام من رو هم با اکراه داد,SAD,1.0
غذا کاملا مانده بود و حتی کباب چند تکه شده بود که به نظر می‌رسید مانده مصرف قبلی است. برای نامی که قبلا با افتخار می‌شناختیم یعنی رفتاری متاسفم با این کیفیت نازل و قیمت بالا,SAD,1.0
من مشتری همیشگی هستم متاسفانه غذاهاکیفیت همیشه رو ک نداشت خیلی هم بد بود از کالباس‌های فوق العاده بی کیفیتی استفاده شده بود وهمچنین مرغ مونده واقعاازپرپروک این غذا بعیدبود اصلا قابل توصیه نیست,SAD,1.0
انتظار شکلات سفت و بدون مغز رو با این قیمت بالا نداشتم,SAD,1.0
باسلام برخوردبعضی ازپیکهابسباربی ادبانه وبرخورنده هست حتی جواب سلام هم نمیدن!!!!!!!!!! واقعاممنون ازپیگیریتون,HAPPY,0.0
خوب بود اما حجمشو خیلی کم کردین. با این قیمتی که زدین حجمش کم بود,HAPPY,0.0
مثل سفارش قبلی همه چیز با کیفیت عالی به دستم رسید، رفتار پیک هم بسیار محترمانه بود و به موقع به دستم رسوندن.,HAPPY,0.0
متاسفانه ۷ قلم از لیست خریدم با تاخیر بدستم رسید,SAD,1.0
پنیرش روی سیبزمینی به تناسب ریخته نشده بود ولی در کل خوب بود,HAPPY,0.0
مزه ش فرق کرده بود: (,SAD,1.0
کته کباب لقمه مخصوص بد نبود ولی با این قیمت خیلی با کیفیت‌تر هم میشه تهیه کرد اما کته زرشک با مرغ فاجعه بود فکر نکنم دیگه بدتر از این هم بشه درست کرد پیک اسنپ هم غذارو هم زده تحویل داد و تمام ظاهر غذا از بین رفته بود,SAD,1.0
سیب زمینیتونو عوض نکنید!!!!!!!,HAPPY,0.0
قبلا این پیتزا رو سفارش داده بودم خیلی بهتر از این بود، این سری واقعا اف‌تضاح بود آبروم پیش مهمونم رفت.,SAD,1.0
تازه و خوشمزه بود ولی به نظر کمتر از یک کیلو بود,HAPPY,0.0
من خیلی راضی بودم از خریدم موفق باشید,HAPPY,0.0
غذا خیلی خوشمزه بود ولی من سه تا آش رشته سفارش دادم که فقط یکی آوردن و دوباره با تاخیر فرستادن,HAPPY,0.0
بر خلاف گذشته برنج افتصاح بود … انگار واسه برنج مونده رو دوباره گرم کردن و تحویل دادن. که حتی نمیشه خورد. ای کاش کیفیت کار خودتون رو حفظ میکردید. آبرومون پیش مهمون رفت.,SAD,1.0
با سلام و عرض احترام من دومین بار بود که از شما خرید کردم و شیرینی‌ها و کیک‌ها شما طعم فوق العاده‌ای دارند و با تشکر از سرویس اکسپرس که سریع و سالم کیک را رساند. پاینده باشید.,HAPPY,0.0
سلام، کیفیت غذاها خوب بود. ولی با توجه به فاصله مبلغ ارسال معنایی نداره و به نظرم منصفانه نیست.,HAPPY,0.0
خیلی خوب بود فقط سسش یکم زیاد بود,HAPPY,0.0
غذا بسیار سرد و چرب بود. پول پیکم با اینکه نزدیک رستورانیم و کلا ۵ دقیقه فاصله داریم گرفته میشه.,SAD,1.0
شیر تاریخ روز بود ممنون,HAPPY,0.0
از کی تا حالا سوخاری رو تو ظرفی که تو مراسم برای میوه و شیرنی استفاده میشه، قرار میدن,SAD,1.0
سیب زمینی هاش مونده بود,SAD,1.0
